{
  "$schema": "./shujuku-api.schema.json",
  "name": "shujuku / 神·数据库 API Knowledge Base",
  "language": "zh-CN",
  "updated_at": "2026-04-29",
  "sources": [
    "https://github.com/AlbusKen/shujuku",
    "https://raw.githubusercontent.com/AlbusKen/shujuku/main/API_DOCUMENTATION.md",
    "https://raw.githubusercontent.com/AlbusKen/shujuku/main/manifest.json"
  ],
  "scope_note": "本文件只记录 shujuku（神·数据库 / SP·数据库 II）对外暴露的 window.AutoCardUpdaterAPI 调用接口、数据结构和集成注意事项。不要与 JS-Slash-Runner API 或 SillyTavern 原生扩展 API 混放。",
  "extension": {
    "repository": "https://github.com/AlbusKen/shujuku",
    "manifest": {
      "display_name": "SP·数据库 II",
      "loading_order": 200,
      "js": "index.js",
      "css": "",
      "author": "Cline (AI Assisted)",
      "version": "2.0.0",
      "auto_update": false
    },
    "global_object": "window.AutoCardUpdaterAPI",
    "availability_check": "if (window.AutoCardUpdaterAPI) { /* call api */ }"
  },
  "groups": [
    {
      "name": "plot_presets",
      "title": "剧情推进预设管理 API",
      "apis": [
        {
          "name": "getPlotPresets",
          "signature": "getPlotPresets(): Array<PlotPreset>",
          "description": "获取所有剧情预设完整数据，返回深拷贝。",
          "returns": "Array：预设数组。",
          "example": "const presets = window.AutoCardUpdaterAPI.getPlotPresets();"
        },
        {
          "name": "getPlotPresetNames",
          "signature": "getPlotPresetNames(): string[]",
          "description": "获取剧情推进预设名称列表。",
          "returns": "string[]",
          "example": "const names = window.AutoCardUpdaterAPI.getPlotPresetNames();"
        },
        {
          "name": "getCurrentPlotPreset",
          "signature": "getCurrentPlotPreset(): string",
          "description": "获取当前正在使用的剧情推进预设名称；未选择时返回空字符串。",
          "returns": "string",
          "example": "const current = window.AutoCardUpdaterAPI.getCurrentPlotPreset();"
        },
        {
          "name": "switchPlotPreset",
          "signature": "switchPlotPreset(presetName: string): boolean",
          "description": "切换到指定剧情推进预设。切换成功会保存设置并同步已打开设置面板 UI。切换后 $6 占位符只回溯读取带有该预设名称标签的历史数据，实现剧情规划隔离。",
          "parameters": { "presetName": "要切换到的预设名称" },
          "returns": "boolean：是否切换成功。",
          "example": "const ok = window.AutoCardUpdaterAPI.switchPlotPreset('战斗场景');"
        },
        {
          "name": "getPlotPresetDetails",
          "signature": "getPlotPresetDetails(presetName: string): PlotPreset | null",
          "description": "获取指定预设完整详情，返回深拷贝；未找到返回 null。",
          "parameters": { "presetName": "预设名称" },
          "returns": "PlotPreset|null",
          "example": "const details = window.AutoCardUpdaterAPI.getPlotPresetDetails('战斗场景');"
        },
        {
          "name": "importPlotPresetFromData",
          "signature": "importPlotPresetFromData(presetData: object|string, options?: { overwrite?: boolean; switchTo?: boolean }): Promise<{success:boolean,message:string,presetName?:string}>",
          "description": "无需文件选择器，直接从前端导入单个剧情推进预设。",
          "parameters": { "presetData": "预设对象或 JSON 字符串，必须包含 name", "options.overwrite": "已存在时是否覆盖，默认 false", "options.switchTo": "导入后是否立即切换，默认 false" },
          "returns": "Promise<{success,message,presetName?}>"
        },
        {
          "name": "importPlotPresetsFromData",
          "signature": "importPlotPresetsFromData(presetsArray: Array<object>, options?: { overwrite?: boolean }): Promise<{success:boolean,message:string,imported:number,failed:number,details:Array}>",
          "description": "批量导入多个剧情推进预设。",
          "returns": "Promise<{success,message,imported,failed,details}>"
        },
        {
          "name": "exportAllPlotPresets",
          "signature": "exportAllPlotPresets(): Array<PlotPreset>",
          "description": "导出所有剧情推进预设深拷贝。",
          "returns": "Array<PlotPreset>"
        }
      ]
    },
    {
      "name": "table_data",
      "title": "数据导入导出与表格操作 API",
      "apis": [
        {
          "name": "exportTableAsJson",
          "signature": "exportTableAsJson(): object",
          "description": "导出当前合并后的表格数据对象。同步函数。",
          "returns": "object",
          "example": "const tableData = window.AutoCardUpdaterAPI.exportTableAsJson();"
        },
        {
          "name": "importTableAsJson",
          "signature": "importTableAsJson(jsonString: string): Promise<boolean>",
          "description": "导入并覆盖当前表格数据。",
          "parameters": { "jsonString": "JSON 格式表格数据字符串" },
          "returns": "Promise<boolean>"
        },
        {
          "name": "exportJsonData",
          "signature": "exportJsonData(): Promise<void>",
          "description": "导出当前 JSON 数据到文件，会弹出保存对话框。"
        },
        {
          "name": "updateCell",
          "signature": "updateCell(tableName: string, rowIndex: number, colIdentifier: string|number, value: any): Promise<boolean>",
          "description": "更新指定表格单个单元格。列可用列名或列索引。更新后自动保存到聊天历史。",
          "parameters": { "tableName": "表格名称", "rowIndex": "行索引，0 为表头，1 为第一行数据", "colIdentifier": "列名或列索引", "value": "新值" },
          "returns": "Promise<boolean>"
        },
        {
          "name": "updateRow",
          "signature": "updateRow(tableName: string, rowIndex: number, data: Record<string, any>): Promise<boolean>",
          "description": "按列名-值映射更新整行，只更新 data 指定列。保存到该表最后出现楼层；找不到则保存到最新 AI 楼层；保存后自动触发世界书重新写入。",
          "returns": "Promise<boolean>"
        },
        {
          "name": "insertRow",
          "signature": "insertRow(tableName: string, data: Record<string, any>): Promise<number>",
          "description": "在指定表格表尾插入新行。成功返回新行索引，失败返回 -1。",
          "returns": "Promise<number>"
        },
        {
          "name": "deleteRow",
          "signature": "deleteRow(tableName: string, rowIndex: number): Promise<boolean>",
          "description": "删除指定表格某行。不能删除表头 rowIndex=0。",
          "returns": "Promise<boolean>"
        }
      ]
    },
    {
      "name": "settings_update_worldbook",
      "title": "设置、更新与世界书 API",
      "apis": [
        { "name": "openSettings", "signature": "openSettings(): Promise<void>", "description": "打开神·数据库设置面板。" },
        { "name": "openVisualizer", "signature": "openVisualizer(): void", "description": "打开可视化编辑器。" },
        { "name": "manualUpdate", "signature": "manualUpdate(): Promise<void>", "description": "立即执行手动更新，等价于点击立即手动更新按钮。" },
        { "name": "triggerUpdate", "signature": "triggerUpdate(): Promise<void>", "description": "外部触发增量更新。" },
        { "name": "setZeroTkOccupyMode", "signature": "setZeroTkOccupyMode(modeEnabled: boolean): Promise<void>", "description": "设置 0TK 占用模式。true=世界书条目禁用；false=世界书条目启用。" },
        { "name": "setOutlineEntryEnabled", "signature": "setOutlineEntryEnabled(enabled: boolean): Promise<void>", "description": "设置总结大纲/总体大纲世界书条目启用状态。推荐使用 setZeroTkOccupyMode 替代。" },
        { "name": "syncWorldbookEntries", "signature": "syncWorldbookEntries(options?: { createIfNeeded?: boolean }): Promise<void>", "description": "立即同步世界书注入条目；createIfNeeded 默认 true。" },
        { "name": "refreshDataAndWorldbook", "signature": "refreshDataAndWorldbook(): Promise<boolean>", "description": "强制刷新数据并重新注入世界书：重新加载聊天记录表格、合并独立表、更新世界书条目、通知 UI 刷新。" },
        { "name": "deleteInjectedEntries", "signature": "deleteInjectedEntries(): Promise<void>", "description": "删除当前注入目标世界书里的本插件生成条目。" }
      ]
    },
    {
      "name": "txt_import",
      "title": "TXT 导入链路 API",
      "apis": [
        { "name": "importTxtAndSplit", "signature": "importTxtAndSplit(): Promise<void>", "description": "导入 TXT 文件并分割。" },
        { "name": "injectImportedSelected", "signature": "injectImportedSelected(): Promise<void>", "description": "注入选中的导入内容。" },
        { "name": "injectImportedStandard", "signature": "injectImportedStandard(): Promise<void>", "description": "标准方式注入分割条目。" },
        { "name": "injectImportedSummary", "signature": "injectImportedSummary(): Promise<void>", "description": "以总结方式注入分割条目。" },
        { "name": "injectImportedFull", "signature": "injectImportedFull(): Promise<void>", "description": "完整注入分割条目。" },
        { "name": "deleteImportedEntries", "signature": "deleteImportedEntries(): Promise<void>", "description": "删除导入条目。" },
        { "name": "clearImportedEntries", "signature": "clearImportedEntries(clearAll?: boolean): Promise<void>", "description": "清除导入条目缓存；clearAll 默认 true。" },
        { "name": "clearImportCache", "signature": "clearImportCache(clearAll?: boolean): Promise<void>", "description": "清除 localStorage 导入缓存；clearAll 默认 true。" }
      ]
    },
    {
      "name": "template_management",
      "title": "模板管理 API",
      "apis": [
        { "name": "importTemplate", "signature": "importTemplate(options?: { scope?: 'global'|'chat' }): Promise<void>", "description": "通过文件选择器导入模板；scope 默认 global，chat 表示仅注入当前聊天。" },
        { "name": "exportTemplate", "signature": "exportTemplate(options?: { scope?: 'global'|'chat' }): Promise<void>", "description": "导出模板到文件；scope=chat 时导出当前聊天模板快照。" },
        { "name": "resetTemplate", "signature": "resetTemplate(options?: { scope?: 'global'|'chat' }): Promise<void>", "description": "重置模板为默认值；scope=chat 时仅重置当前聊天模板。" },
        { "name": "resetAllDefaults", "signature": "resetAllDefaults(): Promise<void>", "description": "重置所有设置为默认值。" },
        { "name": "overrideWithTemplate", "signature": "overrideWithTemplate(): Promise<void>", "description": "用模板覆盖最新层数据。" },
        { "name": "getTableTemplate", "signature": "getTableTemplate(): object|null", "description": "获取当前运行态实际使用的表格模板：优先聊天级模板覆写，否则当前 profile 全局模板。" },
        { "name": "getTemplatePresetNames", "signature": "getTemplatePresetNames(): string[]", "description": "获取全局模板预设名称列表。" },
        { "name": "switchTemplatePreset", "signature": "switchTemplatePreset(presetName: string, options?: { scope?: 'global'|'chat' }): Promise<{success:boolean,scope:string,message:string}>", "description": "切换模板预设；presetName 为空表示默认模板；scope 默认 global，chat 表示仅当前聊天。" },